,研究生:,研究生_外文,論文名稱,論文名稱_外文:,指導教授,指導教授_外文,口試委員,口試委員_外文,學位類別,校院名稱,系所名稱,學門,學類,論文出版年,畢業學年度,語文別,論文頁數,中文關鍵詞,外文關鍵詞,相關次數,點閱,下載,書目收藏,摘要,引用,連結網址
13,黃兆駿,"HUANG,JHAO-JYUN",照護資料視覺化的連動式分析與呈現,Analysis and Presentation of Healthcare Data Visualization,吳帆,"WU,FAN",梁亞文、李亞欣,"LIANG,YA-WEN、LI,YA-XIN",碩士,國立中正大學,資訊管理系醫療資訊管理研究所,商業及管理學門,醫管學類,2016,104,中文,32,視覺化、連動式、長期照護、大數據,,,點閱:227,0,3,"
由於近幾年社會與人口的急遽變遷，我國老年人口也正在快速的增長，在2014年底65歲以上老人所占比例已達12.0%，我國國民健康與保健型態亦漸漸轉變為慢性疾病與慢性功能障礙盛行的時代，且我國在2015年通過長期照護保險草案的影響，因此對長期醫療照護的需求也隨之成長，長期照護相關議題成為重要的議題。隨著長照醫療環境的日趨競爭，長期照護機構經營者已經將焦點放在經營成本的控制良好，且能維持一定水準的醫療品質。許多資訊管理相關的研究指出，使用資訊科技對於組織績效的提升有相當正面的助益，McCandless and Norretranders (2013)更指出，在所有感官中，視覺對於資訊的反應速度是最快的，使用視覺化的圖表更能增加12%的網路流量。本研究使用商業軟體QlikView，實作以長照機構為例並以可視覺化、連動式呈現的系統，資料來源為某護理之家資料庫，以視覺化、連動式的方式，針對長期照護資料，進行大數據分析，提供即時性且多構面的內容，其中構面包括長期照護住戶基本資料、住戶照護量表、照護品管指標、院內收支情況等，研究目的期望本系統能協助管理者決策、控制管理成本、對於組織內資訊的訊獲取速度更快更直覺性，最終達成提升管理品質進而提升醫療品質。","<div style=""padding:10px;text-align:left;"">
Ma, R., &amp; Singh, G. (2004, October). Large-scale infographic image downsizing. In Image Processing, 2004. ICIP'04. 2004 International Conference on (Vol. 3, pp. 1661-1664). IEEE.<br/>Hart, G. (2013). Effective Infographics: Telling Stories in the Technical Communication Context. Downloaded October, 1, 2013.<br/>Meeusah, N., &amp; Tangkijviwat, U. (2013). Effect of data set and hue on a content understanding of infographic.<br/>Siricharoen, W. V., &amp; Siricharoen, N. How Infographic should be evaluated?.<br/>Choi, B., Lee, Y., &amp; Park, S. (2006). A Research on Interactive Infographics for Effective Visual Communication. Journal of Korean Society of Design Science,19(2), 229-240.<br/>Diakopoulos, N., Kivran-Swaine, F., &amp; Naaman, M. (2011, May). Playable data: characterizing the design space of game-y infographics. In Proceedings of the SIGCHI Conference on Human Factors in Computing Systems (pp. 1717-1726). ACM.<br/>Kane, R. A., Kane, R. L., &amp; Ladd, R. C. (1998). The heart of long term care. Oxford University Press.<br/>Brunelli, J. (2010). SHOWCASING TWENTY YEARS OF VENICE PROJECT CENTER RESULTS USING INTERACTIVE ONLINE INFOGRAPHICS(Doctoral dissertation, WORCESTER POLYTECHNIC INSTITUTE).<br/>Bubela, T., Nisbet, M. C., Borchelt, R., Brunger, F., Critchley, C., Einsiedel, E., ... &amp; Jandciu, E. W. (2009). Science communication reconsidered. Nature biotechnology, 27(6), 514-518.<br/>Pipps, V., Walter, H., Endres, K., &amp; Tabatcher, P. (2009). Information recall of internet news: does design make a difference? A pilot study. Journal of Magazine &amp; New Media Research, 11(1), 1-20.<br/>Schmidt, A. (2013). Bachelor Thesis Interactive Visualization of Software Defined Networks (Doctoral dissertation, Saarland University).<br/>Kernisan, Leslie.　(2015) ""Activities of Daily Living: What Are ADLs and IADLs?"". Caring.<br/>Hogan, M. (2013) What is Big Data<br/>Gupta, A., &amp; Gupta, A. (2015). AD-HOC EP CURVE CALCULATION USING MAP-REDUCE AND UI INTEGRATION WITH QLIKVIEW. International Journal of Advances in Engineering &amp; Technology, 8(5), 823.<br/>Michael, K., &amp; Miller, K. (2013). Big data: New opportunities and new challenges [guest editors' introduction]. Computer, 46(6), 22-24.<br/>Sagiroglu, S., &amp; Sinanc, D. (2013, May). Big data: A review. In Collaboration Technologies and Systems (CTS), 2013 International Conference on (pp. 42-47). IEEE.<br/>黃斯聖. (2008). 老年失智症之照顧者的負荷及憂鬱的相關因素探討. 中山醫學大學醫學研究所學位論文, (2008 年), 1-108.<br/>林惠文, 楊博仁, 楊宜瑱, 陳俊傑, 陳宣志, 顏啟華, ... &amp; 李孟智. (2010). 台灣地區老年人憂鬱之預測因子探討-十年追蹤結果分析. 台灣老年醫學暨老年學雜誌,5(4), 257-265.<br/>葉濬彰. (2011). 社區老人的主觀社會地位, 自尊, 自我掌控信念與憂鬱之關係. 中原大學心理學研究所學位論文, 1-77.<br/>王珊瑜. (2007). 台北市小型安養護機構老人認知功能之探討: 簡易智能狀態量表 (MMSE) 之運用. 臺灣大學社會工作學研究所學位論文, 1-127.<br/>鍾雪珍. (2008). 新版 EBSCOhost2. 0 資訊視覺化檢索簡介.<br/><a href=""http://readopac2.ncl.edu.tw/nclJournal/search/detail.jsp?dtdId=000040&amp;search_type=detail&amp;la=ch&amp;checked=&amp;unchecked=&amp;sysId=0005898939"" target=""_blank"">吳淑瓊. (2005). 人口老化與長期照護政策. 國家政策季刊, 4(4), 5-24.</a><br/><a href=""http://readopac2.ncl.edu.tw/nclJournal/search/detail.jsp?dtdId=000040&amp;search_type=detail&amp;la=ch&amp;checked=&amp;unchecked=&amp;sysId=0005868405"" target=""_blank"">廖士程, 李明濱, 謝博生, &amp; 李源德，(2005)。醫病關係與醫療滿意度之全國性普查。醫學教育 9(2)，149-161。</a><br/>楊志良.(2000)‧老人照護政策之規劃‧二十一世紀老人照護研討會講義‧台灣台北。<br/><br/></div>",https://hdl.handle.net/11296/5f4ebc
14,廖詩漢,"LIAO,SHIH-HAN",以QlikView對醫療資料庫作大數據分析-以某護理之家為例,Data Analysis With Big Aata Technique For Nursing Home With The Help of Qlikview,吳帆,"WU,FAN",蔣以仁、徐宏修,"JIANG,YI-REN、SYU,HONG-SIOU",碩士,國立中正大學,資訊管理系研究所,電算機學門,電算機一般學類,2016,104,中文,118,QlikView、護理之家、大數據分析、可視化圖表,QlikView、nursing home、big data technique、visualization chart,,點閱:1159,59,4,"
隨著時代的進步，科技越來越發達，電腦軟硬體設備的進步，資訊產品可以儲存的資料量越來越大，而越來越大的資料量已經不足以資料來稱呼，故將這些龐大的資料群，稱之為巨量資料、大數據等名稱，這些大數據資料，傳統的資料分析軟體已經無法負荷，必須使用專門的大數據分析軟體才能輕鬆的達成從前的資料分析工作。在眾多資料軟體當中，本研究挑選出一套免費又簡單的軟體QlikView作為研究用數據分析工具，希望藉由此軟體，為雜亂無章且不易分析整理的護理之家資料庫資料，做成令人淺而易懂的可視化圖表，而且可以透過簡單的操作，將所需要的資訊在幾下簡單的點選中呈現出來。因目前學術界上，很少有人以QlikView做大數據分析為討論範圍做研究，大部分是介紹此軟體的相關功能，本研究希望能做到一個承先啟後的效果，承襲前人將此軟體發掘出來，開啟後進對QlikView這套軟體做大數據分析的研究興趣，可以對QlikView與大數據分析開啟各個面向的探討與研究。","<div style=""padding:10px;text-align:left;"">
中文部份<br/>大數據可視化產品選型(民104年4月17日)。民104年12月19日，取自：中國統計網：https://read01.com/3G3zo4.html<br/><br/>商業智能解決方案之政府醫療保健機構(無日期)。民104年12月5日，取自：QlikView官網：http://global.qlik.com/cn/explore/solutions/industries/public-sector/government-healthcare<br/><br/>資料庫(民104年7月20日)。民104年12月5日，取自：維基百科：https://zh.wikipedia.org/wiki/%E6%95%B0%E6%8D%AE%E5%BA%93<br/><br/>資料視覺化(民105年2月日)。民104年7月2日，取自：維基百科：https://zh.wikipedia.org/wiki/%E6%95%B0%E6%8D%AE%E5%8F%AF%E8%A7%86%E5%8C%96<br/><br/>數位資料整理術(民96年1月8日)，民104年12月19日，取自：經理人月刊：<br/>http://www.managertoday.com.tw/index.php/articles/view/538<br/><br/>數據分析(無日期)。民104年12月5日，取自：MBA智庫百科：http://wiki.mbalib.com/zh-tw/%E6%95%B0%E6%8D%AE%E5%88%86%E6%9E%90<br/><br/>關聯式資料庫(民98年7月6日)。民104年12月5日，取自：維基百科：https://zh.wikipedia.org/wiki/%E5%85%B3%E7%B3%BB%E6%95%B0%E6%8D%AE%E5%BA%93<br/><br/><br/>英文部份<br/>Bryant, R., Katz, R. H., &amp; Lazowska, E. D. (2008). Big-data computing: Creating revolutionary breakthroughs in commerce, science and society.<br/>Bughin, J., Chui, M., &amp; Manyika, J. (2010). Clouds, big data, and smart assets: Ten tech-enabled business trends to watch. McKinsey Quarterly, 56(1), 75-86.<br/>Chen, C. P., &amp; Zhang, C. Y. (2014). Data-intensive applications, challenges, techniques and technologies: A survey on Big Data. Information Sciences, 275, 314-347.<br/>Cukier, K., &amp; Mayer-Schoenberger, V. (2013). Rise of Big Data: How it's Changing the Way We Think about the World, The. Foreign Aff., 92, 28.<br/>Lopatenko, A. (2015). QlikView as a Data Management Solution.<br/>Nielsen, E. W., Hovland, A., &amp; Stromsnes, O. (2006). [A new tool for retrieving clinical data from various sources]. Tidsskrift for den Norske laegeforening: tidsskrift for praktisk medicin, ny raekke, 126(5), 605-607.<br/>Golfarelli, M., Rizzi, S., &amp; Proli, A. (2006, November). Designing what-if analysis: towards a methodology. In Proceedings of the 9th ACM international workshop on Data warehousing and OLAP (pp. 51-58). ACM.<br/>Groves, P., et al., (2013). The ‘big data’revolution in healthcare. McKinsey Quarterly.<br/>Gupta, A., &amp; Gupta, A. (2015). AD-HOC EP CURVE CALCULATION USING MAP-REDUCE AND UI INTEGRATION WITH QLIKVIEW. International Journal of Advances in Engineering &amp; Technology, 8(5), 823.<br/>Herodotou, H., et al., (2011, January). Starfish: A Self-tuning System for Big Data Analytics. In CIDR (Vol. 11, pp. 261-272).<br/>Kaisler, S., et al., (2013, January). Big data: Issues and challenges moving forward. In System Sciences (HICSS), 2013 46th Hawaii International Conference on (pp. 995-1004). IEEE.<br/>Michael, K., &amp; Miller, K. (2013). Big data: New opportunities and new challenges [guest editors' introduction]. Computer, 46(6), 22-24.<br/>Sagiroglu, S., &amp; Sinanc, D. (2013, May). Big data: A review. In Collaboration Technologies and Systems (CTS), 2013 International Conference on (pp. 42-47). IEEE.<br/>Schuette, M. (2013). Evolution of Research Reporting–From Excel to QlikView. Planning for Research Excellence in the Era of Analytics, 62.<br/>Serbanescu, L. (2009). Business Intelligence Solutions For Human Resource Management. The Annals of the"" Stefan cel Mare"" University of Suceava. Fascicle of The Faculty of Economics and Public Administration, 9(Special), 162-168.<br/>Tene, O., &amp; Polonetsky, J. (2012). Privacy in the age of big data: a time for big decisions. Stanford Law Review Online, 64, 63.<br/>Zeng, J., &amp; Zhang, J. (2013). Using Dashboard for Lean Revenue Cycle Management. iBusiness, 5(03), 100.<br/></div>",https://hdl.handle.net/11296/fh3dy2
15,盧信吉,"LU,HSIN-CHI",以數理邏輯為基礎進行程式資料處理結果驗證 --以入學招生分發結果為例,Establishment of a Inspection System based on Mathematical Logic: A Case Study of the College Admission,吳帆,"WU,FAN",黃仁竑、張榮貴、吳帆,"HWANG,REN-HUNG、CHANG,RONG-GUEY、WU,FAN",碩士,國立中正大學,資訊管理系研究所,電算機學門,電算機一般學類,2016,104,中文,55,數理邏輯、命題邏輯、一階邏輯、軟體測試、資料驗證,Mathematical Logic、Propositional logic、First-order logic、Software testing、Data verification,,點閱:123,0,1,"
以電腦系統程式來取代人工處理各種龐大的資料量，是現今社會普遍常見的作法。但系統程式在處理大量資料過程中，如何確保其處理結果是正確無誤；尤其程式設計師所撰寫的程式碼中，還是會存在某些無法預期的邏輯性錯誤。因此我們必須透過各種檢核機制，來確認程式執行結果是否與預期相同。在程式設計領域中，很多程式設計師的解決問題思維，往往被既有的程式開發工具所限制住，形成盲點自我設限。若能強化程式設計師的數理邏輯概念，在遇到問題時，可以先換個方向來分析和整理，很多重大突破，往往就是這樣產生的。本研究建立一套資料處理後的檢核驗證程式，著重在檢核條件需先以數理邏輯進行分析，發展出檢核條件的邏輯表示式，並與使用者共同討論檢視後，才能依據邏輯表示式進行程式開發，確保在開發程式時，不會偏離原有的檢核條件需求。本研究以大學繁星推薦招生之分發比序結果來進行個案研究，透過本次研究所提出的作業模式和具代表性的檢核程式，其測試結果達到當初預期的目的，同時也讓試務單位對於檢核程式有相當大的信任感。但未來亦需持續增加檢核程式的建立和因應招生規則的變動來修正檢核條件，以達到分發檢核經驗的延續和傳承。","<div style=""padding:10px;text-align:left;"">
一、中文文獻<br/>人工智慧：現代方法(3版) (歐崇明、時文中、陳龍 編譯) (民100)。 臺北市：台灣培生教育出版。 (原著出版年：2009年)<br/>大考中心基金會 (民98)。 大學入學考試中心20周年特輯：選才文摘大學入學考試制度類。 臺北市：大考中心基金會。<br/>大學甄選入學委員會 (民103)。 104學年度大學「繁星推薦」入學招生簡章。嘉義縣：大學甄選入學委員會。<br/>大學甄選入學委員會 (民102)。 103學年度大學「繁星推薦」入學招生簡章。嘉義縣：大學甄選入學委員會。<br/>李宗翰 (民104年7月19日)。 在軟體開發期間就能找出安全性漏洞。 iThome電腦報週刊，669期，36-37。<br/>李家同 (民100)。 人人都能學會寫程式:李家同教你用邏輯思考學程式設計。 台北市：聯經。<br/>修斐士‧席爾 (民77)。 初級數理邏輯。 (劉福增 評著)。 臺北市：水牛。 (原著出版年﹕1963年)<br/>陳瑞麟 (民94)。 邏輯與思考(2版)。 臺北市：學富文化。<br/>彭孟堯 (民89)。 符號邏輯。 臺北市：心理。<br/>項潔 (民104)。布爾與電腦。科學月刊，551，858-861。<br/>黃西川 (民102)。 簡易離散數學。 臺北市：五南。<br/>黃中彥 (民100)。 基礎離散數學。 新北市：新文京開發。<br/>董世平 (民104)。布爾與邏輯。科學月刊，551，852-857。<br/>齊斯‧德福林 (民103)。 這個問題，你用數學方式想過嗎?。 (洪萬生、黃俊瑋、蘇惠玉、陳彥宏、葉吉海 譯)。 臺北市：城邦文化事業股份有限公司。 (原著出版年：2012年)<br/>劉福增 (民92)。 邏輯思考。 臺北市：心理。<br/>離散數學 (呂威甫、施文慈 譯) (民98)。 臺北市：碁峰資訊。 (原著出版年：2003年)<br/> <br/>二、英文文獻<br/>Boris Beizer (1990). Software Testing Techniques. New York: Van Nostrand Reinhold.<br/>Elliott Mendelson (1997). Introduction to Mathematical Logic. Chapman &amp; Hall.<br/>Keith Devlin (2012). Introduction to Mathematical Thinking. USA: Keith Devlin.<br/>Klement, Kevin C. (2006). Propositional Logic. James Fieser and Bradley Dowden (eds.). Internet Encyclopedia of Philosophy. Eprint.<br/>Myers, G. J. (1979). The art of software testing, New York: Wiley.<br/><br/>三、網路資料<br/>大學招生委員會聯合會(無日期)，大學招生委員會聯合會組織架構【公告】。民國103年7月15日，取自：http://www.jbcrc.edu.tw/index1.htm<br/>大學招生委員會聯合會(無日期)。 入學管道【公告】。 民國103年7月15日，取自：http://www.jbcrc.edu.tw/left-31.htm<br/>大學甄選入學委員會 (民102)。 統計資料【公告】。 民國103年7月10日，取自：https://www.caac.ccu.edu.tw/cacportal/index.php<br/>吳維漢 (2012-09-07)。 數學與程式設計。 國立中央大學數學系。 民103年2月10日，取自：http://www.ziyou.math.ncu.edu.tw/~ziyou/c++/downloads/math.pdf<br/>教育部全球資訊網高等教育司 (民103年4月21日)。 103學年度大學日間學制各學系（組）招生名額分配核定表【公告】。 民國103年9月8日，取自：http://www.edu.tw/userfiles/url/20140421091752/1030415_103%E5%90%8D%E9%A1%8D%E6%97%A5%E5%AD%B8%E6%A0%B8%E5%AE%9A%E8%A1%A8_%E4%B8%8A%E5%82%B3%E7%89%88.pdf<br/>教育部全球資訊網高等教育司 (無日期)。 102學年度大學日間學制各學系（組）招生名額分配核定表【公告】。 民國103年9月8日，取自：http://www.edu.tw/FileUpload/1075-17585/Documents/1020107_102%E5%90%8D%E9%A1%8D%E6%97%A5%E5%AD%B8%E6%A0%B8%E5%AE%9A%E8%A1%A8po%E7%B6%B2.xlsx<br/><br/><br/><br/></div>",https://hdl.handle.net/11296/atp8ck
