,研究生:,研究生_外文,論文名稱,論文名稱_外文:,指導教授,指導教授_外文,口試委員,口試委員_外文,學位類別,校院名稱,系所名稱,學門,學類,論文出版年,畢業學年度,語文別,論文頁數,中文關鍵詞,外文關鍵詞,相關次數,點閱,下載,書目收藏,摘要,引用,連結網址
0,蕭君翰,"HSIAO,CHUN-HAN",對圖形資料庫進行並行控 制的研究,Research on Concurrency Control on Graph Database,吳帆,WU FAN,吳帆、張宏義、薛幼苓,"WU,FAN、CHANG,HUNG-YI、HSUEH,YU-LING",碩士,國立中正大學,資訊管理系研究所,電算機學門,電算機一般學類,2020,108,中文,74,圖形資料庫、並行控制、死結預防、可序列化,Graph Database、Concurrency Control、deadlock prevention、serializability,,點閱:32,8,1,"
2019 年繼 1987 年對關聯式資料庫的結構化查詢語言(SQL)標準成為國際標準組織(ISO)的資料庫查詢語言標準後，第二種資料庫查詢語言標準圖查詢語言(GQL)被提案至 ISO，為填補對圖形資料庫查詢語句(就像 SQL 之於關聯式資料庫)的不足。有鑑於 GQL 是新出的標準，尚未有其他人做過並行控制的研究，本研究設計了一套應用於圖形資料庫上的並行控制系統。該系統分為資料管理與鎖定狀態管理兩部分。資料儲存模型利用資料粒度將系統中的資料儲存區分為四層，其中第三層採用了紅黑樹結構降低了執行成本。並行控制機制採用雙版本的二階段鎖定，並用等-死法做為確保可序列化與死結預防的輔助機制。","<div style=""padding:10px;text-align:left;"">
Crawford, B.(2016). Granular Security In A Graph Database. Unpublished doctoral<br/>dissertation, Naval Postgraduate School, Monterey, California, United States.<br/>Lomet, D. (1995). Private Lock Management (Cambridge research laboratory<br/>technical report series No. 92/9). Cambridge, United Kingdom: University of<br/>Cambridge, Cambridge research laboratory.<br/>Alex, H., Steven ,S., &amp; Steven, H.(2005). On deadlock, livelock, and forward<br/>progress (Tech. Rep. No. 633). Cambridge, United Kingdom: University of<br/>Cambridge, Computer Laboratory.<br/>Batra, S., &amp; Tyagi, C. (2012). Comparative analysis of relational and graph databases.<br/>International Journal of Soft Computing and Engineering (IJSCE), 2(2), 509-512.<br/>Cahill, M. J., Rohm, U., &amp; Fekete, A. D. (2009, December). Serializable Isolation for<br/>Snapshot Databases. ACM Transactions on Database Systems, 34(4), 20:1-20:42.<br/>Wu, H., Chin, W. N., &amp; Jaffar, J. (2002, January). An efficient distributed deadlock avoidance<br/>algorithm for the AND model. IEEE Transactions on Software Engineering, 28(1), 18-29.<br/>Jabal, A. A., &amp; Bertino, E. (2016, October). SimP: Secure Interoperable MultiGranular Provenance Framework. Paper presented at the International<br/>Conference on eScience, Baltimore, Maryland, United States.<br/>Lin, W. K., &amp; Nolte, J. (1983). Basic Timestamp, Multiple Version Timestamp,<br/>and Two-Phase Locking. Paper presented at International Conference on Very<br/>Large Data Bases, Florence, Italy. 109-119.<br/>Mohamed, M., Badawy, M., &amp; El-Sayed, A. (2016). Survey on Concurrency<br/>Control Techniques. Communications on Applied Electronics, 5(1), 28-31.<br/>Robinson, I., Webber, J., &amp; Eifrem, E. (2015). Graph databases. Sebastopol,<br/>CA, United States: O’Reilly Media, Inc.<br/>Son, S. H., &amp; David, R. (1994, November). Design and Analysis of A Secure<br/>Two-Phase Locking Protocol. Paper presented at the International Computer<br/>Software and Applications Conference, Taipei, Taiwan.374-379<br/></div>",https://hdl.handle.net/11296/r8yap3
1,方楷文,"FANG, KAI-WEN",使用詞向量加權計算之聊天機器人的建置與效益,Implementation and Effectiveness for Chatbot Using Weighted Average Word Embedding,吳帆,"WU,FAN",吳帆、許巍嚴、洪銘建,"WU, FAN、HSU, WEI-YEN、HUNG, MING-CHIEN",碩士,國立中正大學,資訊管理系研究所,電算機學門,電算機一般學類,2020,108,中文,55,聊天機器人、Word2Vec、詞向量、TF-IDF、支援向量機,Chatbot、Word2Vec、Word vector、TF-IDF、SVM,,點閱:40,0,1,"
    隨著深度學習和自然語言處理的技術不斷進步，加上電子商務及即時通訊軟體的普及，促使問答聊天機器人的需求不斷提高。然而，使用者輸入的訊息千奇百怪，而且一個問題的表達方式可能有好幾種，甚至許多時候還會超出預設問答集本身的範圍，使得聊天機器人運用於常見問答更具複雜性及挑戰性。    本論文設計並提出一個基於檢索的一般性聊天機器人系統，利用大量電影及影集字幕的簡短對話來做為開放式問答集的來源，並以開放式問答集來處理超出預設問答集的情況。我們在聊天機器人的系統架構中使用Word2Vec預訓練的詞向量模型及TF-IDF（Term Frequency-Inverse Document Frequency）來得到每一個加權字詞向量，接著算出每一個問題文本的平均加權向量，再透過支援向量機（Support Vector Machine, SVM）分類模型、餘弦相似度方法、開放式問答集、推播通知和錯誤處理，建構出一個問答聊天機器人系統，具有語義層面上的檢索能力，且會隨著使用時間越久，回覆的準確度也將隨之提高。最後本論文以兩個不同領域的商家來實做客服問答聊天機器人，根據情境任務及問卷的分析結果顯示約八成的受測者認為可以快速且正確的取得一般問題的答案。期望可以透過本論文提出的聊天機器人系統，能做為第三方開發問答聊天機器人所參考的依據，並且能夠得到不錯的表現結果。","<div style=""padding:10px;text-align:left;"">
[1]Bickmore, T. W., Schulman, D., &amp; Sidner, C.（2013）. Automated interventions for multiple health behaviors using conversational agents. Patient education and counseling, 92（2）, 142-148.<br/>[2]Cameron, A. F., &amp; Webster, J. J. C. i. H. b. (2005). Unintended consequences of emerging communication technologies: Instant messaging in the workplace. 21(1), 85-103.<br/>[3]Caselles-Dupré, H., Lesaint, F., &amp; Royo-Letelier, J.（2018, September）. Word2vec applied to recommendation: Hyperparameters matter. In Proceedings of the 12th ACM Conference on Recommender Systems, 352-356.<br/>[4]Collobert, R., Weston, J., Bottou, L., Karlen, M., Kavukcuoglu, K., &amp; Kuksa, P.（2011）. Natural language processing（almost）from scratch. Journal of machine learning research, 12（ARTICLE）, 2493− 2537.<br/>[5]Graf, B., Krüger, M., Müller, F., Ruhland, A., &amp; Zech, A.（2015, November）. Nombot: simplify food tracking. In Proceedings of the 14th International Conference on Mobile and Ubiquitous Multimedia, 360-363.<br/>[6]Djaballah, K. A., Boukhalfa, K., &amp; Boussaid, O. (2019, December). Sentiment Analysis of Twitter Messages using Word2vec by Weighted Average. In 2019 Sixth International Conference on Social Networks Analysis, Management and Security(SNAMS), 223-228.<br/>[7]Higashinaka, R., Imamura, K., Meguro, T., Miyazaki, C., Kobayashi, N., Sugiyama, H., Hirano, T., Makino, T., Matsuo, Y.（2014, August）. Towards an open-domain conversational system fully based on natural language processing. In Proceedings of COLING 2014, the 25th International Conference on Computational Linguistics: Technical Papers, 928-939.<br/>[8]Kerly, A., Ellis, R., &amp; Bull, S.（2008, April）. CALMsystem: a conversational agent for learner modelling. In International Conference on Innovative Techniques and Applications of Artificial Intelligence,  Applications and Innovations in Intelligent Systems, 89-102.<br/>[9]Kowsher, M., Alam, M. A., Uddin, M. J., Islam, M. R., Pias, N., &amp; Saifullah, A. R. M.（2019, July）. Bengali Informative Chatbot. In 2019 International Conference on Computer, Communication, Chemical, Materials and Electronic Engineering（IC4ME2）, 1-7<br/>[10]Lester, J., Branting, K., &amp; Mott, B.（2004）. Conversational agents. The Practical Handbook of Internet Computing, 220-240.<br/>[11]Lo, R. T.-W., He, B., &amp; Ounis, I.（2005）. Automatically building a stopword list for an information retrieval system. In Journal on Digital Information Management: Special Issue on the 5th Dutch-Belgian Information Retrieval Workshop（DIR）.<br/>[12]Manning, C., &amp; Schutze, H.（1999）. Foundations of statistical natural language processing, Cambridge, MA.: MIT press.<br/>[13]Mikolov, T., Chen, K., Corrado, G., &amp; Dean, J.（2013）. Efficient estimation of word representations in vector space. arXiv preprint arXiv:1301.3781.<br/>[14]Mikolov, T., Sutskever, I., Chen, K., Corrado, G. S., &amp; Dean, J.（2013）. Distributed representations of words and phrases and their compositionality. In Advances in neural information processing systems, 3111–3119.<br/>[15]Razzaghnoori, M., Sajedi, H., &amp; Jazani, I. K.（2018）. Question classification in Persian using word vectors and frequencies. Cognitive Systems Research, 47, 16-27.<br/>[16]Rumelhart, D. E., Hinton, G. E., &amp; McClelland, J. L.（1986）. A general framework for parallel distributed processing. Parallel distributed processing: Explorations in the microstructure of cognition, 1（45-76）, 26.<br/>[17]Sharma, V., Goyal, M., &amp; Malik, D.（2017）. An intelligent behaviour shown by chatbot system. International Journal of New Technology and Research, 3（4）, 2454-4116.<br/>[18]Shevat, A.（2017）. Designing Bots: Creating Conversational Experiences. California, CA: O'Reilly Media, Inc.<br/>[19]Singh, S. P., Kearns, M. J., Litman, D. J., &amp; Walker, M. A. （2000）. Reinforcement learning for spoken dialogue systems. In Advances in Neural Information Processing Systems., 956-962.<br/>[20]Thada, V., &amp; Jaglan, V.（2013）. Comparison of jaccard, dice, cosine similarity coefficient to find best fitness value for web retrieved documents using genetic algorithm. International Journal of Innovations in Engineering and Technology, 2（4）, 202-205.<br/>[21]Wang, H., Lu, Z., Li, H., &amp; Chen, E.（2013, October）. A dataset for research on short-text conversations. In Proceedings of the 2013 Conference on Empirical Methods in Natural Language Processing, 935-945.<br/>[22]Warschauer, M., &amp; Healey, D.（1998）. Computers and language learning: An overview. Language teaching, 31（2）, 57-71.<br/>[23]Weizenbaum, J.（1966）. ELIZA---a computer program for the study of natural language communication between man and machine. Communications of the ACM, 9（1）, 36-45.<br/>[24]Wu, Y., Li, Z., Wu, W., &amp; Zhou, M.（2018）. Response selection with topic clues for retrieval-based chatbots. Neurocomputing, 316, 251-261.<br/>[25]Young, S., Gašić, M., Thomson, B., &amp; Williams, J. D.（2013）. Pomdp-based statistical spoken dialog systems: A review. Proceedings of the IEEE, 101（5）, 1160-1179.<br/>[26]Zadrozny, W., Budzikowska, M., Chai, J., Kambhatla, N., Levesque, S., &amp; Nicolov, N.（2000）. Natural language dialogue for personalized interaction. Communications of the ACM, 43（8）, 116-120.<br/>[27]Zhang, D., Xu, H., Su, Z., &amp; Xu, Y.（2015）. Chinese comments sentiment classification based on word2vec and SVMperf. Expert Systems with Applications, 42（4）, 1857-1863.<br/><br/><br/></div>",https://hdl.handle.net/11296/4x4cm4
2,周如娟,"CHOU, JUCHUAN",使用網路爬蟲建構知識庫提供決策提醒-以新興產品5G為例,Building a knowledge base for decision reminding with web crawler-Take 5G product for example,吳帆,"Wu,Fan",吳帆、羅峻旗、許巍嚴,"Wu,Fan、Lo, Chun-Chi、Hsu,Wei-Yen",碩士,國立中正大學,資訊管理系研究所,電算機學門,電算機一般學類,2020,108,中文,51,5G、資料視覺化、文字探勘,5G、data visualization、text exploration,,點閱:115,0,1,"
在資訊發逹的年代，每個人隨時都可透過網路來搜尋資訊，搜尋引擎下達關鍵字之後，眾多資訊排列而出，使用者在這些龐大的資料下，難以短時間查得真正適合的相關資訊，且接觸的資訊過多會使人注意力無法集中，要尋找符合自己所需的資料是費時又困難的。本研究以5G為搜尋的主題，利用網路爬蟲搜集2016年至2019年間的新聞網站文章，並藉由文字探勘技術提取與主題關聯性較高的關鍵字，相關聯關鍵字集成為一知識庫，並依據搜集資料的特徵，設計具互動性及主題關聯性的視覺化圖形，讓主題相關聯的資訊易於理解與獲得；本研究針對想關注議題提供提醒功能，只依據有興趣、想關注的議題提供通知訊息，透過個人訊息管理策略來過濾並簡化訊息，可以減少資訊過載問題。","<div style=""padding:10px;text-align:left;"">
英文文獻<br/>Aizawa, A. J. I. P., &amp; Management. (2003). An information-theoretic perspective of tf–idf measures. 39(1), 45-65.<br/>Anand, A., De Veciana, G., &amp; Shakkottai, S. (2018). Joint scheduling of URLLC and eMBB traffic in 5G wireless networks. Paper presented at the IEEE INFOCOM 2018-IEEE Conference on Computer Communications.<br/>Andrews, J. G., Buzzi, S., Choi, W., Hanly, S. V., Lozano, A., Soong, A. C., et al. (2014). What will 5G be? , 32(6), 1065-1082.<br/>Bao, F., &amp; Chen, J. (2014). Visual framework for big data in d3. js. Paper presented at the 2014 IEEE Workshop on Electronics, Computer and Applications.<br/>Bertino, E., Guerrini, G., &amp; Merlo, I. (2000). Trigger inheritance and overriding in an active object database system. IEEE Transactions on Knowledge and Data Engineering, 12(4), 588-608.<br/>Bockelmann, C., Pratas, N., Nikopour, H., Au, K., Svensson, T., Stefanovic, C., et al. (2016). Massive machine-type communications in 5G: Physical and MAC-layer solutions. 54(9), 59-65.<br/>Demšar, J., Curk, T., Erjavec, A., Gorup, Č., Hočevar, T., Milutinovič, M., et al. (2013). Orange: data mining toolbox in Python. The Journal of Machine Learning Research, 14(1), 2349-2353.<br/>Edmunds, A., &amp; Morris, A. (2000). The problem of information overload in business organisations: a review of the literature. International journal of information management, 20(1), 17-28.<br/>Friederici, A. D. J. T. i. c. s. (2002). Towards a neural basis of auditory sentence processing. 6(2), 78-84.<br/>Hao, L., &amp; Hao, L. (2008). Automatic identification of stop words in chinese text classification. Paper presented at the Computer Science and Software Engineering, 2008 International Conference on.<br/>Kabra, N., Patel, J. M., Yu, J.-B., Nag, B., &amp; Chen, J.-J. (2004). Method and apparatus for parallel execution of trigger actions: Google Patents.<br/>Kirk, A. (2012). Data Visualization: a successful design process: Packt Publishing Ltd.<br/>Ma, W.-Y., &amp; Chen, K.-J. (2003). Introduction to CKIP Chinese word segmentation system for the first international Chinese Word Segmentation Bakeoff. Paper presented at the Proceedings of the second SIGHAN workshop on Chinese language processing-Volume 17.<br/>Mahto, D. K., &amp; Singh, L. (2016). A dive into Web Scraper world. Paper presented at the 2016 3rd International Conference on Computing for Sustainable Global Development (INDIACom).<br/>Osseiran</div>",https://hdl.handle.net/11296/2y6v68
3,吳義萬,"WU, YI-WAN",電子病歷資訊安全實證研究,Empirical Research on Information Security of Electronic Medical Record,吳帆,"WU, FAN",林俊榮、洪銘建,"LIN,CHUN-JUNG、HUNG,MING-CHIEN",碩士,國立中正大學,資訊管理系醫療資訊管理研究所,商業及管理學門,醫管學類,2019,108,中文,55,電子病歷、資訊安全、資料庫、資料軌跡紀錄、資料遮罩,Electronic Medical Record、Information security、Database、Data Loss Prevention、Data Mask,,點閱:136,1,1,"
隨著科技的進步，醫療院所的病歷資料開始電子化，資訊科技帶來了便利性，隨之產生了許多資訊安全的問題。近年來電子病歷的資訊安全議題都備受重視，許多研究都有相關的探討，但本研究發現許多的研究議題都主要著重在防護外部的威脅，內部人員的疏失等研究相對較少，但近幾年的新聞事件中，由人員所引發的資料外洩問題頻頻出現，為改善此問題，因此本研究擬定了一個資訊安全防護方法，著重在內部人員洩漏資訊的問題防護。  本研究著重於資料遮罩以及資料遮罩，建置可用不同符號來遮蔽的資料遮罩，以及監控資料庫軌跡動作的觸發程序，針對新增、刪除、修改監控是誰做、如何做、何時、為了甚麼等，並且建立觸發程序的副本，使用該副本可以快速建立每個資料表的觸發程序，另外還可以透過SQL工具來儲存使用者的訪問記錄，最後用網頁的方式來呈現整體的資訊安全防護運作模式。藉由本研究規劃的資訊安全策略，加強電子病歷資料庫的內部防護，改善資料外洩的問題再度發生。","<div style=""padding:10px;text-align:left;"">
中央研究院 資訊服務處（民國107）。資安課程。民國108年1月28日，取自：https://its.sinica.edu.tw/site/datas/detail/12595/38/167/282/0<br/>王平、林文暉、郭溥村、王子夏與盧永翔（民99）。雲端運算服務之資安風險與挑戰。Communications of the CCISA，16(4)。<br/>安資捷(股)公司（民國105）。Informatica DDM 動態資料遮罩。民國108年1月28日，取自：http://www.amxecure.com/index.php/products-solutions/tactics-policy-services/db-security/168-informatica-ddm<br/>吳昭儀（民106）。ISO27001 最新版標準條文介紹，民國108年1月28日，取自：https://its.sinica.edu.tw/uploads/editor/files/20170426-ISO27001.pdf<br/>周彥妤（民國107年06月20日）。北市聯醫外洩愛滋病患3000筆個資 坦言有疏失。自由時報。<br/>林孝儒（民國107年09月12日）。紐約醫院爆個資外洩，98名病患資訊被看光。蘋果日報。<br/>施惟堯（民105）。A4: 基於屬性加密演算法之電子病歷系統的身分認證, 授權與存取控制機制。交通大學電機工程系所學位論文，1-74。<br/>洪彬益（民103）。導入資料外洩防護系統關鍵影響因素之多重個案研究。交通大學管理學院資訊管理學程學位論文，1-79。<br/>陳怡均（民國107年10月10日）。50萬個資外洩Google＋關閉。工商時報。<br/>陳衍良（民104）。如何防止醫院員工違反電子病歷隱私保護政策。義守大學醫務管理學系學位論文，1-51。<br/>陳維揚（民105）。以ISO27001探討醫院資訊安全系統。中正大學資訊管理系醫療資訊管理研究所學位論文，1-46。<br/>傅家妤（民國107年05月19日）。紅髮艾德入院「個資外洩」，醫院員工遭開除。ETtoday新聞雲。<br/>曾昭宏（民國95）。認識資訊安全標準”BS7799””ISO27001”。民國95年12月05日，取自：https://www.cga.gov.tw/GipOpen/wSite/ct?xItem=33830&amp;ctNode=4336&amp;mp=999033<br/>曾愽睿（民107）。運用時間戳記之安全存取機制於電子病歷系統。東海大學電機工程學系學位論文，1-44。<br/>黃仁俊與張軒齊（民107）。雲端外儲系統資料保護機制。資訊安全通訊，24(3)，1-15。<br/>楊漢湶. (2012). 電子病歷與病人隱私權保護. 澄清醫護雜誌, 8(1), 4-8。<br/>資訊安全網頁。附錄A資通安全管理規範。民國108年1月28日，取自：http://auis.epage.au.edu.tw/ezfiles/288/1288/img/2505/149554988.pdf.<br/>樊國楨、劉家志與黃健誠（民99）。資訊安全護理之一: 終端護理。資訊安全通訊，16(1), 4-25。<br/>衛生福利部資訊處（民107）。民107年12月10日，取自：https://emr.mohw.gov.tw/pmointro.aspx<br/>衛生福利部電子病歷交換中心（民104）。民107年12月10日，取自：https://eec.mohw.gov.tw/?PAGE=Overview<br/>鄭翠碧（民國108年06月24日）。伊院護士疑洩612求診者私隱 院方邀「外援」處理投訴。香港01。<br/>魯明德（民102）。電子病歷安全防護。清流月刊，1。<br/>叡揚資訊 資安事業處（民國104）。金融機構DLP導入案例 預防資料外洩風險。民國108年1月28日，取自：https://www.gss.com.tw/index.php/focus/security/1431-gss-0118-dlp<br/>臉書承認遭駭客攻擊 5000萬用戶有個資外洩風險（民國107年9月29日）。自由時報。<br/>Adrian Michael Booth, and Manmeet Singh Bhasin (2009). Real-time enterprise data masking. U.S. Patent Application No. 12/287, 324.<br/>Basavaraj Biradar (2016). INSERTED and DELETED Logical Tables in Sql Server. Retrieved September 16, 2018, from http://sqlhints.com/2016/02/28/inserted-and-deleted-logical-tables-in-sql-server/<br/>Brisebois, M., &amp; Johnstone, C. (2017). System and method for data loss prevention across heterogeneous communications platforms. U.S. Patent No. 9,578,060. Washington, DC: U.S. Patent and Trademark Office.<br/>Farkash, Ariel, Igor Gokhman, and Sivan Rabinovich.(2018). Dynamic data masking of post-output database data. U.S. Patent No. 9,911,003.Washington, DC: U.S. Patent and Trademark Office.<br/>Garg, Sushil. (2017). Survey on Cloud Computing and Data Masking Techniques.<br/>GK, Ravi Kumar, B. Justus Rabi, and T. N. Manjunath. (2012). A study on dynamic data masking with its trends and implications.<br/>Iain Fergusson (2006). System and method for dynamic data masking. U.S. Patent Application No. 10/957,971.<br/>Kristen M Krysko, Noah M Ivers, Jacqueline Young, Paul O’Connor, and Karen Tu (2015). Identifying individuals with multiple sclerosis in an electronic medical record. Multiple Sclerosis Journal, 21(2), 217-224.<br/>Mansfield-Devine, S. (2014). Network Security. Masking sensitive data, 2014(10), 17-20.<br/>Medvedev, I. (2017). Systems and methods for data loss prevention while preserving privacy. U.S. Patent No. 9,740,877. Washington, DC: U.S. Patent and Trademark Office.<br/>OWASP(2017). OWASP Top Ten 2017. Retrieved, October 30, 2019 from https://www.owasp.org<br/>Shukla, M., Joseph, J., Vidhani, K., Banahatti, V. M., and Lodha, S.(2015) Dynamic data masking. U.S. Patent No. 9,171,182. Washington, DC: U.S. Patent and Trademark Office.<br/>Simon Liu, and Rick Kuhn (2010). Data loss prevention. IT professional, 12(2).<br/>Steven Patrick Pomroy, Robert Raymond Lake, Trevor Anthony Dunn(2011). Data masking system and method. U.S. Patent No. 7,974,942.<br/>Stevestein(2018). SQL Server Management Studio (SSMS) - SQL Server. Retrieved, October 16, 2018 from https://docs.microsoft.com/en-us/sql/ssms/sql-server-management-studio-ssms?view=sql-server-2017&amp;viewFallbackFrom=sql-server-201<br/>Tomoyoshi Takebayashi, Hiroshi Tsuda, Takayuki Hasebe, and Ryusuke Masuoka (2010). Data loss prevention technologies. Fujitsu Scientific and Technical Journal, 46(1), 47-55.<br/>VanMSFT. (2017). Security Center for SQL Server Database Engine and Azure SQL Database - SQL Server. Retrieved September 16, 2018 from https://docs.microsoft.com/en-us/sql/relational-databases/security/security-center-for-sql-server-database-engine-and-azure-sql-database?view=sql-server-2017<br/>Yui K. Ho, William C. Moyer, and Joseph A. Gutierrez (1994). Data processor with concurrent static and dynamic masking of operand information and method therefor. U.S. Patent No. 5,319,763.<br/><br/></div>",https://hdl.handle.net/11296/q222jc
