,研究生:,研究生_外文,論文名稱,論文名稱_外文:,指導教授,指導教授_外文,口試委員,口試委員_外文,學位類別,校院名稱,系所名稱,學門,學類,論文出版年,畢業學年度,語文別,論文頁數,中文關鍵詞,外文關鍵詞,相關次數,點閱,下載,書目收藏,摘要,引用,連結網址
6,潘雅惠,"PAN,YA-HUEI",醫療機構主管運用大數據資訊系統之管理指標研究,KPI system for executive of hospital healthcare institute Based on big data analysis,吳帆,"Wu, Fan",白佳原、莊坤洋,"Pai, Jar-Yuan、Chuang, Kun-Yang",碩士,國立中正大學,資訊管理系研究所,電算機學門,電算機一般學類,2018,106,中文,57,大數據資訊系統、醫療績效、醫療指標、大數據,big data、medical indicators、performance、big data information systems,,點閱:260,0,1,"
資訊科技已經明顯的改變現代人的觀念並創造新的生活習慣。隨著時代快速的變遷，網路時代發達，民眾對於醫療照護品質觀念也跟著改變，高品質的醫療服務已成為民眾的就醫基本共識，使得不論是醫療院所或是長照機構經營更加的困難。如何提升經營績效指標且持續更新，不僅在有更好的效率更有助於及早除錯、即時修正，還可以避免沿用錯誤的資料影響決策規劃。績效管理的最終目的是提高生產率和效率，可以讓高階主管專注在自己業務不需耗費人工時間審核資料數據內容。本研究主要利用大數據視覺化系統因應醫療機構高階主管資訊系統之經營指標數據為例。大數據被認為是未來技術最重要的領域之一，且正在迅速引起許多行業的關注，因它可以為企業提供高價值的決策來源。這些發現促使研究人員和管理人員能夠同時了解大數據技術可以為公司帶來的最大潛在收益，並採取相對應行動，從最大限度提高投資回報率，並從大數據中獲取高價值，這是一舉數得的行動。本研究採取專家問卷，問卷受測者為機構負責人及醫療機構績效組主管，醫療機構涵蓋範圍較廣相較於長照機構較為複雜，但對於利用大數據系統呈現數據方式對於高階主管而言，不論是醫療機構或是長照機構，都可以隨時掌握機構內部之營運狀況，除此之外也能縮短人工作業時間及錯誤率，利用資訊系統不儘可以加快醫療機構經營指標的分析也能加快高階主管進行決策。主管資訊系統在管理上除了可以提供高階主管及機構負責人有較佳的管控功能之外，對於醫療評鑑資料蒐集方面也能快速完成。經過第一次專家訪談及第二次專家驗證後，將經營績效指標問卷分為五大項中分為五個細項，結果顯示依據醫療機構與長照機構經營績效指標上差異相當大，雖然同為醫療產業，經營指標與管理指標所注重程度較為不同，在二十五項細項指標中只有三項相同指標，其他二十二項為差異項，從中得知同為醫療產業但經營管理層面有相當大差異性。","<div style=""padding:10px;text-align:left;"">
中文參考文獻<br/>36大數據(民國104年3月18日)。盤點55個最實用的大數據可視化分析工具。民國104年3月18日，取自： http://www.36dsj.com/archives/24173。<br/>王美慧、陳瑞龍、林憬、江克儉(民94)。醫院績效衡量之研究-以花蓮某區域醫院為例。顧客滿意學刊，1(2)，107-130。<br/>朱正一(民95)。醫務管理:制度,組織與實務。華泰文化事業股份有限公司。<br/>阮玉梅(民88)。長期照護。國立空中大學，未出版，新北市。<br/>段伴虬、溫育慧(民105)。 長期照護機構經營管理成功關鍵因素之探討-以南投縣某機構為例。福祉科技與服務管理學刊，4(2)，317-318。<br/>侯榮英、張文信、蕭智維、江宜靜(民99)。運用商業智慧系統建構視覺化會計圖表應用於醫院管理-以南部某醫院為例。醫務管理期刊，11(3)，75-87。<br/>吳思華(民89)。策略九說(第三版)。臺北市：臉譜出版。<br/>梁定澎(民92)。決策支援系統與企業智慧。智勝文化出版，臺北市。<br/>徐慧娟、薛亞聖(民90)。 醫院管理指標的性質與應用。Hospital，p29-41。<br/>孫本初、鍾京佑(民94). 治理理論之初探政府。 市場與社會治理架構。公共行政學報，(16)， 107-135。<br/>莊文忠(民97)。績效衡量與指標設計:方法論上的討論。公共行政學報，(29)，61-91。<br/>陳澤義、陳啟斌 (民95)。企業診斷與績效評估:平衡計分卡之運用。台北市:華泰。<br/>张挺(民94)。我国医疗机构的竞争优势和基本竞争战略。中国卫生资源，11(4)，154-155。<br/><a href=""http://ndltd.ncl.edu.tw/cgi-bin/gs32/gsweb.cgi?o=dnclcdr&amp;s=id=%22095NCCU5388102%22.&amp;searchmode=basic"" target=""_blank"">陳立基(民95)。台灣地區老人安養護機構經營管理關鍵成功因素。政治大學經營管理碩士學程 (EMBA)學位論文，1-109。</a><br/>張明裕、梁凡偉（民95）。以 AHP 法分析線上遊戲作置入式行銷廣告模式之研究。未出版。南台科技大學，未出版，台南市。<br/>http://www. aea-taiwan. org/SEAIT2013/papers/IT09. pdf.<br/>褚志鵬(民98)。層級分析法 (AHP) 理論與實作。 國立東華大學企業管理學系 教授， 民國九十八年.<br/>曾郁薇 (民102)。用於發展高階主管資訊系統之改良式醫院績效評估架構。國立台北護理健康大學，未出版，台北市。<br/>黃昱霖、吳宗翰、林峰正、衷嵐焜(民102)。巨量資料視覺化之研究.:<br/>黃怡詔、簡禎富、劉志明、賴威齊、劉昕昶(民93)。建構網際網路環境下之醫院主管資訊系統及其實證研究。工業工程學刊，21(2)，101-112。<br/>楊鎮維、方世杰、黃維民。(民94)醫療機構經營策略與營運績效之研究: 社會性套系觀點。福爾摩莎醫務管理雜誌，1(2)，124-133。<br/>餘明玲、薛亞聖、黃興進(2005)。影響醫院資訊系統績效評估之關鍵因素:高階主管觀點之實證研究，台灣公共衛生雜誌,24(1)，22-32。<br/>廖詩漢(民105)。以 QlikView 對醫療資料庫作大數據分析-以某護理之家為例。中正大學資訊管理學系學位論文，1-118。<br/>劉籹君、黃興進、廖則竣 (民99)。決策支援系統使用績效之實證研究:結合任務-科技適配與資訊系統成功模式。電子商務學報，12(3)，407-430。<br/>賴威齊(2003)。以平衡計分卡為基礎建構網際網路環境下之醫院高階主管資訊系統及其實證研究。元培醫事科技大學，未出版，新竹市。<br/>蕭文(民82)。醫院管理資訊系統，台本市：書華。<br/>簡禎富、林鼎浩、徐紹鐘、彭誠湧(民90)。建構半導體晶圓允收測試資料挖礦架構及其實證研究。Journal of the Chinese Institute of Industrial Engineers，18(4)，37-48。<br/><br/><br/>英文參考文獻<br/>Azad, M. M., Amin, M. B., &amp; Alauddin, M. (2012). Executive information system. International Journal of Computer Science and Network Security (IJCSNS),12(5), 106.<br/>Badawy, M., El-Aziz, A. A., Idress, A. M., Hefny, H., &amp; Hossam, S. (2016). A survey on exploring key performance indicators.Future Computing and Informatics Journal.<br/>Chow, H. W., Ling, G. J., Yen, I. Y., &amp; Hwang, K. P. (2016). Building brand equity through industrial tourism. Asia Pacific Management Review.<br/>Chen, X., &amp; Jin, R. (2017). Statistical modeling for visualization evaluation through data fusion. Applied ergonomics.<br/>Dess, G. G., &amp; Robinson, R. B. (1984). Measuring organizational performance in the absence of objective measures: the case of the privately‐held firm and conglomerate business unit. Strategic management journal,5(3), 265-273.<br/>Davenport, T. (2014). Big data at work: dispelling the myths, uncovering the opportunities. harvard Business review Press.<br/>Eroshkin, S. Y., Kameneva, N. A., Kovkov, D. V., &amp; Sukhorukov, A. I. (2017). Conceptual System in the Modern Information Management. Procedia Computer Science, 103, 609-612.<br/>Fernandes, B. H. R. (2006). Competências e desempenho organizacional: o que há além do Balanced Scorecard. Saraiva.<br/>Freeman, E., Knapp, M., &amp; Somani, A. (2017). Long-term care organization and financing.<br/>Franková, P., Drahošová, M., &amp; Balco, P. (2016). Agile Project Management Approach and its Use in Big Data Management. Procedia Computer Science, 83, 576-583.<br/>Gandomi, A., &amp; Haider, M. (2015). Beyond the hype: Big data concepts, methods, and analytics. International Journal of Information Management, 35(2), 137-144.<br/>Gupta, M., &amp; George, J. F. (2016). Toward the development of a big data analytics capability. Information &amp; Management, 53(8), 1049-1064.<br/>Gong, M., Simpson, A., Koh, L., &amp; Tan, K. H. (2016). Inside out: The interrelationships of sustainable performance metrics and its effect on business decision making: Theory and practice. Resources, Conservation and Recycling.<br/>Ivascu, M. (2016). Improving the Managerial Performance in Health Care Systems. Procedia Economics and Finance, 39, 777-784.<br/>Kaganski, S., Majak, J., Karjust, K., &amp; Toompalu, S. (2017). Implementation of key performance indicators selection model as part of the Enterprise Analysis Model. Procedia CIRP, 63, 283-288.<br/>Kayyali, B., Knott, D., &amp; Van Kuiken, S. (2013). The big-data revolution in US health care: Accelerating value and innovation. Mc Kinsey &amp; Company, 2(8), 1-13.<br/>Kokangül, A., Polat, U., &amp; Dağsuyu, C. (2017). A new approximation for risk assessment using the AHP and Fine Kinney methodologies. Safety science, 91, 24-32.<br/>Lungu, I. C. and Bara, A., ""Executive Information Systems’ Multidimensional Models"",<br/>Revista Informatica Economica,vol. 3 , no.43, 2007.<br/>Lukoianova, T., &amp; Rubin, V. L. (2014). Veracity roadmap: Is big data objective, truthful and credible.<br/>Muthuveloo, R., Shanmugam, N., &amp; Teoh, A. P. (2017). The impact of tacit knowledge management on organizational performance: Evidence from Malaysia. Asia Pacific Management Review.<br/>Pramanik, M. I., Lau, R. Y., Demirkan, H., &amp; Azad, M. A. K. (2017). Smart health: Big data enabled health paradigm within smart cities. Expert Systems with Applications, 87, 370-383.<br/>Peral, J., Maté, A., &amp; Marco, M. (2017). Application of Data Mining techniques to identify relevant Key Performance Indicators. Computer Standards &amp; Interfaces, 50, 55-64.<br/>Parmenter, D. (2012). Key performance indicators for government and non profit agencies: implementing winning KPIs. John Wiley &amp; Sons.<br/>Parmenter, D. (2015). Key performance indicators: developing, implementing, and using winning KPIs. John Wiley &amp; Sons.<br/>Rockart, J.F. and Treacy, M.E., “The CEO goes on-line,” Harvard Business Review 60, 1982, pp.82-88.<br/>Ruan, G., &amp; Zhang, H. (2017). Closed-loop Big Data Analysis with Visualization and Scalable Computing. Big Data Research, (8), 12-26.<br/>Raguseo, E. (2018). Big data technologies: An empirical investigation on their adoption, benefits and risks for companies. International Journal of Information Management, 38(1), 187-195.<br/>Seward, J. B. (2017). Paradigm Shift in Medical Data Management: Big Data and Small Data∗.<br/>Sagiroglu, S., &amp; Sinanc, D. (2013, May). Big data: A review. In Collaboration Technologies and Systems (CTS), 2013 International Conference on (pp. 42-47). IEEE.<br/>Sanchez, O. P., &amp; Terlizzi, M. A. (2017). Cost and time project management success factors for information systems development projects. International Journal of Project Management, 35(8), 1608-1626.<br/>van der Geer, E., van Tuijl, H. F., &amp; Rutte, C. G. (2009). Performance management in healthcare: performance indicator development, task uncertainty, and types of performance indicators. Social science &amp; medicine, 69(10), 1523-1530<br/><br/><br/></div>",https://hdl.handle.net/11296/cr4zjb
7,李沛玲,"LEE,PEI-LING",僵直性脊椎炎患者未順從性服藥相關因子之探討,An investigation of the associated factors of medication non-adherence in patients with anskylosing spondylitis,吳帆,"WU,FAN",許巍嚴、呂明錡,"HU,WEI-YAN、LYU,MING-CI",碩士,國立中正大學,資訊管理系醫療資訊管理研究所,商業及管理學門,醫管學類,2018,106,中文,71,僵直性脊椎炎、未順從性服藥,ankylosing spondylitis、medication non- adherence,,點閱:77,0,1,"
僵直性脊椎炎（ankylosing spondylitis）是一個自體免疫及慢性發炎關節疾病，導致脊椎關節的沾黏，伴隨脊柱關節疼痛和僵直症狀。由於脊柱附近肌腱、韌帶等軟組織發炎而造成脊柱自發性融合，形成無法彎曲的「竹節樣脊柱」。僵直性脊椎炎的主要治療方法為藥物，目標以控制病情及維持日常生活功能為主，因此，遵循醫囑規則服藥極為重要。本研究目的在了解僵直性脊椎炎未順從性服藥之相關因素。本研究於南部某區域教學醫院的過敏免疫風濕中心門診進行問卷調查，收案日期為民國2016年11月4日至2017年1月24日，有效樣本206人。藥物順性採用「藥物佔有率」（Medication Possession Ratio, MPR）作為指標，從研究對象的電子病歷回溯前二年服用（1）非類固醇抗炎止痛劑藥物、（2）生物製劑及（3）合併非類固醇抗炎止痛劑藥物和生物製劑兩種藥物的治療處方。藥物佔有率  80%以上界定為藥物順從，藥物佔有率< 80% 者界定為藥物未順從。數據以羅吉斯迴歸分別分析三個藥物未順從的依變項與人口學特徵、健康狀況、脊椎X光片變化、僵直性脊椎炎疾病嚴重度和生活品質之關聯。研究結果顯示僵直性脊椎炎病患使用非類固醇抗炎止痛劑藥物的藥物佔有率為0.80、使用生物製劑的藥物佔有率為0.78、而合併非類固醇抗炎止痛劑藥物和生物製劑兩種藥物的藥物佔有率為0.76。多變項羅吉斯迴歸分析顯示：（1）在非類固醇抗炎止痛劑藥物方面，沒有規律運動者比有規律運動者呈現顯著較高風險的未順從性（勝算比 = 1.99、95%信賴區間 = 1.10–3.59、P = 0.023）、（2）在生物製劑藥物方面，身體質量指數類別為肥胖者比類別為正常和過低者呈現顯著較低風險的未順從性（勝算比 = 0.27、95%信賴區間 = 0.08–0.97、P = 0.045）、（3）在合併非類固醇抗炎止痛劑藥物和生物製劑兩者方面，沒有規律運動者比有規律運動者呈現較高風險的未順從性（勝算比 = 1.76、95%信賴區間 = 1.00–3.11、P = 0.051）。但脊椎X光片變化分級、僵直性脊椎炎疾病嚴重度和生活品質則與藥物未順從性無顯著關聯。綜合而言，本研究的僵直性脊椎炎病患，藥物佔有率未能完全達到0.80的理想標準。建議護理人員針對沒有規律運動者，加強服藥順從性的衛教。","<div style=""padding:10px;text-align:left;"">
中文：<br/>王政為與楊榮森（民102）。僵直性脊椎炎之診斷、治療與併發症。台灣醫學，17（6），687－694。<br/>何振珮與李哲夫（民103）。服藥遵從行為中文量表之信、效度測量。臺灣臨床藥學雜誌，22（2），139－147。<br/>何振珮、尤瑞鴻、劉采艷與李哲夫（民104）。東部某醫院影響高血壓病人服藥遵從行為因素之探討。護理暨健康照護研究，11（1），23－32。<br/>李智、趙藝璞與胡秀英（民105） 。多病共存與老年高血壓患者服藥不遵從行為之相關性研究。護理雜誌，63（5），65－75。<br/>林幸誼、陳靜雯、翁麗雀、陳瑪莉、林秀珍與余光輝（民101）。類風濕性關節炎病人服藥遵從行為與其相關因素探討。長庚護理，23（3），282－298。<br/>吳佳蓉、陳清惠與葉忍莉（民91）。老年患者服藥行為影響因素的探討。長庚護理雜誌，13（2），166－172。<br/>周昌德（民95）。關節痛與腰背痛-如何早期發現僵直性脊椎炎及乾癬關節炎。台北市：健康文化。<br/>周昌德（民101）。僵直性脊椎炎-臨床表徵、診斷及治療。風濕病學。台北市：合記圖書出版社。<br/>陳俊雄、廖顯宗、梁統華與周昌德（民97）。僵直性脊椎炎－早期認知早期治療。內科學誌，19（6），481－490。<br/>施維怡與詹欣隆（民106）。僵直性脊椎炎及軸心型脊椎關節炎診斷之進展。台北市醫師公會會刊，61（7），20－24。<br/> <br/>英文:<br/><br/>Andrade, S. E., Kahler, K. H., Frech, F., &amp; Chan, K. A. (2006). Methods for evaluation of medication adherence and persistence using automated databases. Pharmacoepidemiology and Drug Safety, 15(8):565–574.<br/>Aydin, S. Z., Can, M., Atagunduz, P., &amp; Direskeneli, H. (2010). Active disease requiring TNF-alpha-antagonist therapy can be well discriminated with different ASDAS sets: a prospective, follow-up of disease activity assessment in ankylosing spondylitis. Clinical and Experimental Rheumatology, 28(5), 752–755.<br/>Baraliakos, X., Listing, J., Rudwaleit, M., Sieper, J., &amp; Braunl, J. (2009). Development of a radiographic scoring tool for ankylosing spondylitis only based on bone formation: addition of the thoracic spine improves sensitivity to change. Arthritis Care &amp; Research, 61(6), 764–771.<br/>Braun, J., &amp; Sieper, J. (2007). Ankylosing spondylitis. Lancet, 369(9570), 1379–1390.<br/>Brionez, T. F., &amp; Reveille, J. D. (2008). The contribution of genes outside the major histocompatibility complex to susceptibility to ankylosing spondylitis. Current Opinion in Rheumatology, 20(4):384–391.<br/>Chang, C. T., Hsieh, M. Y., &amp; Kuo, C. F. (2017). Trend of epidemiology of ankylosing spondylitis between 2006 and 2015 in Taiwan: a 10 years nationwide population study. Formosan Journal of Rheumatology, 31(2), 1–9.<br/>Chen, J. A., Hou, T. Y., Liu, F. C., Chen, C. H., Lai, J. H., Chang, D. M., &amp; Kuo,S. Y. (2007). The prevalence of HLA-B27 subtypes in AS patients. Formosan Journal of Rheumatology, 21(1), 52–56.<br/>Cramer, J. A., Roy, A., Burrell, A., Fairchild, C. J., Fuldeore, M. J., Ollendorf, D. A., &amp; Wong, P. K. (2008). Medication compliance and persistence: terminology and definitions. Value in Health, 11(1), 44–47.<br/>Dillon, C. F., &amp; Hirsch, R. (2011). The United States national health and nutrition examination survey and the epidemiology of ankylosing spondylitis. American Journal of the Medical Sciences, 341(4), 281–283.<br/>Doward, L., Spoorenberg, A., Cook, S. A., Whalley, D., Helliwell, P. S., Kay, L. J., ... &amp; Chamberlain, M. A. (2003). Development of the ASQoL: a quality of life instrument specific to ankylosing spondylitis. Annals of the Rheumatic Diseases, 62(1), 20–26.<br/>Garrett, S., Jenkinson, T., Kennedy, L. G., Whitelock, H., Gaisford, P., &amp; Calin, A. (1994). A new approach to defining disease status in ankylosing spondylitis: the Bath Ankylosing Spondylitis Disease Activity Index. Journal of Rheumatology, 21(12), 2286–2291.<br/>Goh, L., &amp; Samanta, A. (2012). Update on biologic therapies in ankylosing spondylitis: a literature review. International Journal of Rheumatic Diseases, 15(5), 445–454.<br/>Khan, M. A. (2002). Update on spondyloarthropathies. Annals of Internal Medicine, 136(12), 896–907.<br/>Lukas, C., Landewe, R., Sieper, J., Dougados, M., Davis, J., Braun, J., ... &amp; Van der Heijde, D. (2008). Development of an ASAS-endorsed disease activity score (ASDAS) in patients with ankylosing spondylitis. Annals of the Rheumatic Diseases, 68(1), 18–24.<br/>Machado, P. M., Landewe, R. B., &amp; van der HEIJDE, D. M. (2011). Endorsement of definitions of disease activity states and improvement scores for the Ankylosing Spondylitis Disease Activity Score: results from OMERACT 10. Journal of Rheumatology, 38(7), 1502–1506.<br/>Machado, P., Landewé, R., Lie, E., Kvien, T. K., Braun, J., Baker, D., ... &amp; Assessment of SpondyloArthritis international Society. (2010). Ankylosing Spondylitis Disease Activity Score (ASDAS): defining cut-off values for disease activity states and improvement scores. Annals of the Rheumatic Diseases, 70(1), 47–53.<br/>Reveille, J.D. (2011). Epidemiology of spondyloarthritis in North America. American Journal of the Medical Sciences, 341(4), 284–286.<br/>Van Der Heijde, D., Braun, J., Dougados, M., Sieper, J., Pedersen, R., Szumski, A., &amp; Koenig, A. S. (2012). Sensitivity and discriminatory ability of the Ankylosing Spondylitis Disease Activity Score in patients treated with etanercept or sulphasalazine in the ASCEND trial. Rheumatology, 51(10), 1894–1905.<br/>Wanders, A., Heijde, D. V. D., Landewé, R., Béhier, J. M., Calin, A., Olivieri, I., ... &amp; Dougados, M. (2005). Nonsteroidal antiinflammatory drugs reduce radiographic progression in patients with ankylosing spondylitis: a randomized clinical trial. Arthritis &amp; Rheumatism, 52(6), 1756–1765.<br/>Xu, M., Lin, Z., Deng, X., Li, L., Wei, Y., Liao, Z., ... &amp; Lin, Q. (2011). The Ankylosing Spondylitis Disease Activity Score is a highly discriminatory measure of disease activity and efficacy following tumour necrosis factor-α inhibitor therapies in ankylosing spondylitis and undifferentiated spondyloarthropathies in China. Rheumatology, 50(8), 1466–1472.<br/>Yeh, F. C., Chen, H. C., Hou, T. Y., Liu, F. C., Kuo, S. Y., Chu, S. J., ... &amp; Chen, C. H. (2014). Diagnostic validity of computed tomography for HLA-B27 negative ankylosing spondylitis: A retrospective study of 209 patients. Formosan Journal of Rheumatology, 28(1), 60–66.<br/>Zhao, L. K., Liao, Z. T., Li, C. H., Li, T. W., Wu, J., Lin, Q., ... &amp; Gu, J. R. (2007). Evaluation of quality of life using ASQoL questionnaire in patients with ankylosing spondylitis in a Chinese population. Rheumatology International, 27(7), 605–611.<br/><br/> <br/><br/></div>",https://hdl.handle.net/11296/6r6c3j
